<?xml version="1.0" encoding="UTF-8" standalone="no"?>
<monsters xmlns:xsi="http://www.w3.org/2001/XMLSchema-instance" xsi:noNamespaceSchemaLocation="whq-monster-schema.xsd">
  <monster factions="undead" id="cot-carrion" name="Carrion" plural="Carrions">
    <wounds>10</wounds>
    <move>8</move>
    <weaponskill>3</weaponskill>
    <ballisticskill>-</ballisticskill>
    <strength>3</strength>
    <toughness>3</toughness>
    <initiative>4</initiative>
    <attacks>3</attacks>
    <gold>450</gold>
    <armor>-</armor>
    <damage>1D6</damage>
    <special>
      <rule id="cot-carrion-attack">Carrion Attack (Ambush, Magic A)</rule>
      <rule id="rpb-fear" param="6">Fear 6</rule>
      <rule id="rpb-fly">Fly</rule>
    </special>
  </monster>
  <monster factions="undead" id="cot-dread-king" name="The Dread King" plural="Dread Kings">
    <wounds>34</wounds>
    <move>6</move>
    <weaponskill>1</weaponskill>
    <ballisticskill>-</ballisticskill>
    <strength>5</strength>
    <toughness>4</toughness>
    <initiative>5</initiative>
    <attacks>4</attacks>
    <gold>2780</gold>
    <armor>3</armor>
    <damage>3D6</damage>
    <special>
      <rule id="rpb-magic-dispel" param="4+">Magic Dispel 4+</rule>
      <rule id="rpb-magic-resistance" param="4+">Magic Resistance 4+</rule>
      <rule id="cot-undead-magic-item">3 x Magic Items</rule>
      <rule id="cot-undead-magic-weapon">Magic Weapon</rule>
      <rule id="rpb-regenerate" param="2">Regenerate 2</rule>
      <magic id="rpb-necromantic" level="3"/>
    </special>
  </monster>
  <monster factions="undead" id="cot-gunther-laranscheld" name="Gunther Laranscheld" plural="Gunther Laranscheld">
    <wounds>15</wounds>
    <move>4</move>
    <weaponskill>4</weaponskill>
    <ballisticskill>3+</ballisticskill>
    <strength>4</strength>
    <toughness>3</toughness>
    <initiative>3</initiative>
    <attacks>2</attacks>
    <gold>550</gold>
    <armor>-</armor>
    <damage>1D6</damage>
    <special>
      <rule id="cot-grimoire-necris">Grimoire Necris</rule>
      <rule id="cot-minions">Minions</rule>
      <magic id="rpb-necromantic" level="1"/>
    </special>
  </monster>
  <monster factions="undead" id="cot-luthor" name="Luthor" plural="Luthor">
    <wounds>8</wounds>
    <move>4</move>
    <weaponskill>3</weaponskill>
    <ballisticskill>-</ballisticskill>
    <strength>5</strength>
    <toughness>5</toughness>
    <initiative>4</initiative>
    <attacks>1</attacks>
    <gold>300</gold>
    <armor>-</armor>
    <damage>1D6</damage>
    <special>
      <rule id="rpb-ignore-blows" param="6+">Ignore Blows 6+</rule>
      <rule id="cot-luthor-special-attack">Special Attack</rule>
    </special>
  </monster>
  <monster factions="undead" id="cot-zombie-dragon" name="Zombie Dragon" plural="Zombie Dragons">
    <wounds>75</wounds>
    <move>6</move>
    <weaponskill>4</weaponskill>
    <ballisticskill>-</ballisticskill>
    <strength>7</strength>
    <toughness>6</toughness>
    <initiative>3</initiative>
    <attacks>6</attacks>
    <gold>5000</gold>
    <armor>8</armor>
    <damage>6D6</damage>
    <special>
      <rule id="rpb-fly">Fly</rule>
      <rule id="rpb-ignore-blows" param="4+">Ignore Blows 4+</rule>
      <rule id="rpb-ignore-pain" param="7">Ignore Pain 7</rule>
      <rule id="rpb-large-monster">Large Monster</rule>
      <rule id="cot-pestilential-breath">Pestilential Breath (Ambush, Magic A)</rule>
      <rule id="rpb-plague">Plague</rule>
      <rule id="rpb-terror" param="13">Terror 13</rule>
    </special>
  </monster>
</monsters>
